Video ID,Comment ID,comments
8EJ3zbKTWQ8,UgwJceOq3nlorGB32KB4AaABAg,I  am  pretty  sure  Justin  was  sharing  about  how  he  was  sexually  abused  by  the  elites  in  the  past
8EJ3zbKTWQ8,UgwlA1danD7qj-6MWe14AaABAg,  Everybody  gangsta  until  you  understand  the  meaning  of  the  song    
8EJ3zbKTWQ8,Ugy3k0v9Td1dwDn2c2B4AaABAg,When  you  realize  what  this  song  is  about  you  can  t  listen  it  on  the  same  way    You  just  can  t  
8EJ3zbKTWQ8,UgzhN3ucqa17pXMTbzB4AaABAg,2010      baby    baby    baby      2015      sorry    sorry    sorry      2020      yummy    yummy    yummy  
8EJ3zbKTWQ8,UgxGNUCkfRo0lqlyACp4AaABAg,We  wish  the  end  of  the  Corona  virus  and  that  there  will  come  beautiful  days  full  of  love  and  happiness
8EJ3zbKTWQ8,Ugy5TJLolk8Fm5p36J94AaABAg,YUMMY      YUMMY            Everybody  on  My    Birthday  Been  like  Singing  This  Was  Made  For  Memories  
8EJ3zbKTWQ8,Ugz6POnitE3Kfy08eqJ4AaABAg,The  first  time  I  heard  this  song  I  thought  the  music  clip  would  be  a  bit  weird  but  when  I  watched  it    I  laughed  so  hard  that  Justin  is  so  smart  to  change  the  idea  to  foods
8EJ3zbKTWQ8,UgzdVu-Pm-3w9n9VIyN4AaABAg,Lots  love  from  india
8EJ3zbKTWQ8,Ugy4PUu76qU3GWWvWpx4AaABAg,That's  so  yummy          
8EJ3zbKTWQ8,Ugxo274Pjc2Qc1LtlhN4AaABAg,JB's  song  and  video  denounces  the  pedophilia  that  are  in  the  industry    has  many  hidden  messages  which  you  should  analyze    go  to  its  official  video  and  the  comments  in  English  that  talk  about  it      it's  actually  JB's  smartest  song  
8EJ3zbKTWQ8,UgzP7a-wl2nznA0k9594AaABAg,I  cant  listen  to  this  song  the  same  way  i  used  to  now  that  i  know  the  true  meaning
8EJ3zbKTWQ8,UgyvEL-pubhSwK-jM794AaABAg,Justin  I  don  t  knew  that    Yummy    was  your  song    I  love  it  
8EJ3zbKTWQ8,UgwLi5ikVpwRCkIQL094AaABAg,Wow  Danny  gonzalez  writes  songs  for  Justin  now  that  neat    3
8EJ3zbKTWQ8,UgxW2dTzHrgBJl4HJ7t4AaABAg,This  song  lyrics  is  so  cool
8EJ3zbKTWQ8,UgzPstj-gmr81w12vI54AaABAg,The  song  is  really  catchy  for  real    i  didn't  know  at  first  what  it  was  about    but  after  i  read  some  things    about  the  pizzagate  and  other  stuff  i  could  figure  it  out    but  damn  is  a  catchy  song
8EJ3zbKTWQ8,UgyPOmjusHY_QJLPFqh4AaABAg,Director    Let  s  just  feed  him
8EJ3zbKTWQ8,UgzduQpjxQ23juqhPFZ4AaABAg,The  only  reason  I  watch  this  was  because  my  brother  said  the  song  says      Yomie      So  i  proved  to  him
8EJ3zbKTWQ8,UgwSaAQouTZ25B_8bWF4AaABAg,Peace  and  love  my  friend  in  faith    3
8EJ3zbKTWQ8,Ugye0GX65a-KPej4Xed4AaABAg,Lots  of  love  from  indonesia
8EJ3zbKTWQ8,UgySfekgeywLWyziG4B4AaABAg,We  got  the  message  Justin  these  elites  are  sick
8EJ3zbKTWQ8,UgyN7QOGOaD3NVxSn6t4AaABAg,  Beliebers  please  vote  for  PEACHES  for  summer  song  of  the  year  on  billboard  
8EJ3zbKTWQ8,UgzrUDoc8MC7eGYcJiN4AaABAg,There  s  a  message  in  this  video    Those  that  know    know      Please  pray  for  Justin      He  wants  nothing  to  do  with  these  evil  demonic  people    Explains  a  lot  when  you  look  at  all  the  struggles  he  has  
8EJ3zbKTWQ8,UgwsPQ3kBYw4DDw_Evd4AaABAg,I  can't  help  to  believe  this  song    covertly    talks  and  tells  us  a  story  about  child  abuse          But  maybe  that's  just  my  interpretation  
8EJ3zbKTWQ8,UgyPcVeWtFK7D6Mooc94AaABAg,I  ve  heard  this  song  before  and  I  didnt  even  know  this  was  a  song  yet  
8EJ3zbKTWQ8,UgwXcFb62xcgqp_x68x4AaABAg,  Hello    I  love  this  song    it's  a  breeze  on  my  headphones
8EJ3zbKTWQ8,UgwLbh_seLVnTYe-p_N4AaABAg,Me      When  my  Gf  cooks  Axone  You  got  that  yummy  yummmy
8EJ3zbKTWQ8,UgysA_mP03V7MaF851V4AaABAg,The  fact  of  he  is  on  the  cake  at  the  final    maybe  can  show  that  he  suffer  abuse  when  was  child  too    This  make  sense  because  he  turned  into  a  star  when  he  was  just  a  Teen
8EJ3zbKTWQ8,UgwNj7H6Th5RH9elY714AaABAg,    OH  MY  GOODNESS          this  is  the  thing  u  need              Pg2  BeSt              There  are  no  limits  here    Am  I  right                    
8EJ3zbKTWQ8,Ugzj1zaB8QyyMFtcaYR4AaABAg,Does  anyone  else  notice  that  his  sweater  has  rips  and  holes  in  it    Like  he  was  attacked  aggressor    Don't  think  it's  coincidence  guys    Definitely  a  message  
8EJ3zbKTWQ8,Ugz_ZTd3q7oM2hWcCY54AaABAg,New  release    Road  to  One  available  to  Pre  Save  now    Coming  soon  to  all  major  music  platforms  https      ditto  fm  road  to  one  via    DittoMusic
8EJ3zbKTWQ8,UgywjXc6lTJ1XXjymBh4AaABAg,Yummy  love  from  india  
8EJ3zbKTWQ8,UgyEzLKEBonoD66szBV4AaABAg,LISTEN    THE  VEIL  IS  BEING  LIFTED    THE  MOST  HIGH  HAS  COMMANDED    SATAN  AND  HIS  FOLLOWERS  TO  EXPOSE  THEIR  HAND
8EJ3zbKTWQ8,UgzbbqIbs65PNmNdC0Z4AaABAg,The  beat  carries  through  out  the  music      
8EJ3zbKTWQ8,Ugw34P5SK59UxbDm3aN4AaABAg,lots  of  love  from  Chennai
8EJ3zbKTWQ8,Ugxya0PVeNIRMdb3NzR4AaABAg,  so  nobody  is  gonna  talk  about  the  fact  that  he  s  wearing  a  candy  necklace  
8EJ3zbKTWQ8,Ugy3y855kGZv0_GQnnJ4AaABAg,The  starting  tune  is  awesome
8EJ3zbKTWQ8,UgwXuZC4fsRCBx1j84B4AaABAg,      THIS  SONG  SOUNDS  LIKE  TWO  SONGS  IN  ONE    
8EJ3zbKTWQ8,Ugy8X0VSlSfBpYDNtat4AaABAg,After  a  year    the  meaning  hit  me    Dayum  
8EJ3zbKTWQ8,Ugyptjui-emCR9ZORO94AaABAg,I  was  listing  to  this  song  on  the  earbuds  and  it  was  sooo  loud  like  ur  in  a  music  world
8EJ3zbKTWQ8,UgxOzav69Ziu9OyNaoR4AaABAg,Day  1  of  listening  to  yummy  for  a  year    Btw  this  is  my  most  fav  song  ever
8EJ3zbKTWQ8,UgwIAbHNJ4yvGryjsCN4AaABAg,Who  s  here  for  the  pizzagate  s  theory  
8EJ3zbKTWQ8,Ugx9xpSw-ihctIAAyI54AaABAg,I  love  this  song  
8EJ3zbKTWQ8,UgyV_vUCI_y7aAXDm_t4AaABAg,Today's  my  first  time  seeing  this  video  and  I'm  really  upset  that  he  has  a    12  hoodie  and  a  candy  necklace  OVER  the  half  a  Bentley  around  his  neck  
8EJ3zbKTWQ8,UgxyaE-AMOtKC__y1eZ4AaABAg,  SHES  SPEAKING  IN  TOUNGES    THAT  BE  THE  DEVILS  TUNE  
8EJ3zbKTWQ8,Ugy23YErBEZ5keMrlb94AaABAg,      THIS  SONG  SOUNDS  LIKE  TWO  SONGS  IN  ONE    
8EJ3zbKTWQ8,UgwLRPZ09zBxT7fDX7Z4AaABAg,Congratulations  on  the  millions  of  views
8EJ3zbKTWQ8,UgyFyRr5H_ofGktUSKp4AaABAg,Fun  fact      People  finds  hard  to  believe  that  this  song  is  1  year  old
8EJ3zbKTWQ8,Ugy79xJZptrjaTu8Lkl4AaABAg,You  don't  miss  the  person      You  only  miss  the  memories    
8EJ3zbKTWQ8,Ugx4cvIEGGPPPUc12BN4AaABAg,4  years  waiting  for  the  masses  to  wake  up  to  pizza  gate    Justice  is  coming  
8EJ3zbKTWQ8,Ugyyb0Hv_QYcA8pos714AaABAg,those  who  are  at  his  table  are  all  those  who  abused  him  understand
8EJ3zbKTWQ8,UgzmDg9gQTtSM-ZO4S94AaABAg,FEBRUARY  2020    People  coming  here  to  make  jokes  and  memes    JULY  2020    People  coming  here  to  regret  
8EJ3zbKTWQ8,UgyOV7F_AX3QEKk_-9V4AaABAg,As  soon  as  you  start  singing  I  smiled  your  so  good  with  that  gift  of  singing
8EJ3zbKTWQ8,UgykoducK9YcSzDAqk14AaABAg,He  been  wildin  since  he  got  married  to  Hailey      
8EJ3zbKTWQ8,UgzXjl6uIAh-ifVU24F4AaABAg,Justin  s  Q  and  A  made  me  scroll  down  for  30  minutes  straight
8EJ3zbKTWQ8,Ugy1fRPVb-dHeP_C62h4AaABAg,the  music  is  very  good    I'm  Brazilian  and  I  love  this  song  a  lot
8EJ3zbKTWQ8,UgzlmtG7Y6Ioibt1umR4AaABAg,Before  Peaches  there  s  Yummy  wait  what    I  thought  I  had  peaches  so  it  taste  yummy  hahaha
8EJ3zbKTWQ8,UgxjrzZUzxf_NNWW0SJ4AaABAg,I  LOVE  THIS  SONG
8EJ3zbKTWQ8,Ugzn29QjjMfLV6VorvR4AaABAg,Lots  of  Love  From  Nepal
8EJ3zbKTWQ8,UgwVAslKBapXVD5Z0Ch4AaABAg,This  song  is  very  veryyyyyy  Amazing  and  cool
8EJ3zbKTWQ8,UgzkIQEY3HHOi7EGYKl4AaABAg,Director      how  much  do  you  want  the  fans  to  be  hungry      Justin      yes
8EJ3zbKTWQ8,Ugw6LHbl42vksKWuaER4AaABAg,He  s  calling  them  out    Whoop  whoop    Way  to  go  Beebs    
8EJ3zbKTWQ8,UgxBqc3iBVD1xHbQkCZ4AaABAg,0    Nudity  0    Cars    0    Money  100    Food
8EJ3zbKTWQ8,UgxRE8OAb_Wyb9UI39Z4AaABAg,His  father  in  law  was  like          Your  song  was  inspired  by  WHAT    
8EJ3zbKTWQ8,UgxHLzqGZsrx288RY7J4AaABAg,Ever  since  I  saw  that  Sherliza  Moe  video    I  see  this  in  a  COMPLETELY  different  light    Jesus  Christ
8EJ3zbKTWQ8,UgwoqK0TzD3GkImVtG54AaABAg,Lots  of  love  from  tamil  nadu
8EJ3zbKTWQ8,UgxiI3SmhVoQGHvw3_J4AaABAg,Lost  of  love    from  India  
8EJ3zbKTWQ8,UgwCsjzUlgYN65A0tgB4AaABAg,Just  so  Danny  doesn't  get  copyright  imma  watch  this
8EJ3zbKTWQ8,Ugw4hGev-4Wngu5yAW14AaABAg,Justin  and  do  you  feel  good  about  what  you  do  the  humble  is  always  going  to  be  the  perfection  of  anything
8EJ3zbKTWQ8,UgzwQBZB5TuLfJletUl4AaABAg,Did  u  notice  that  one  of  the  Podesta  emails  has  the  name  of  the  song    It  says    Instead  of  Pasta  and  wonderful  sauces  it  was  a  lovely  tempting  assortment  of  cheeses    yummy  
8EJ3zbKTWQ8,Ugy5LLrQZn6p97Cxstd4AaABAg,i  love  this  song    
8EJ3zbKTWQ8,Ugzb_CgRMXEIBBjiNQd4AaABAg,i  need  to  stuff  my  face  with  fries  now
8EJ3zbKTWQ8,UgycFZEWoN9WnAnQKQx4AaABAg,4  years  from  now  we  would  comment  on  this  video  like    damn  remember  all  the  corona  stuff  
8EJ3zbKTWQ8,UgybBqeo0kBEo300cX14AaABAg,1st  time    what  crap  is  this    5th  time    ok    i  can't  get  it  out  of  my  head    maybe  one  more  time  i'll  get  bored  of  it  soon  10th  time    man    actually  a  good  song  100th  time      chorus  blasting  100    volume  and  singing    Yeah  you  got  that  yummmmy  yumm  yeah  500th  time    fuckin  addictive  best  JB  song        
8EJ3zbKTWQ8,UgySdPXNlaEWiSGFjpB4AaABAg,    I  love  the  video
8EJ3zbKTWQ8,UgwgfNtj20IH3COxBk94AaABAg,Still  love  it  
8EJ3zbKTWQ8,UgzZjQCfZW5rV5pCNex4AaABAg,His  music  rides  on  audio  toon
8EJ3zbKTWQ8,Ugxm1VWnSyijo9bMzrV4AaABAg,I  always  found  it  weird  that  he  only  hard  promoted  only  THIS  SONG
8EJ3zbKTWQ8,UgyYwdOdy85rRx_XAgx4AaABAg,I  love  its  song
8EJ3zbKTWQ8,Ugxz0qWNJ4K9bCr--cV4AaABAg,Yummy  yummy    I  love  it  hey
8EJ3zbKTWQ8,UgyyUv5H86awaTitnIl4AaABAg,I  guess  Eminem  didn't  want  anymore  of  his  moms  spaghetti  
8EJ3zbKTWQ8,Ugymyw1K3RrsSqS-cvV4AaABAg,2021  6  7    2022  12  30      2021    2022still  listening  to  this  song
8EJ3zbKTWQ8,UgxZseHVYUCNYqJ_eWx4AaABAg,My  mom    Chloe  don  t  talk  while  eating    it  s  gross  and  disrespectful  Me      starts  singing  this  song    Mom    ok
8EJ3zbKTWQ8,UgwGhW8DseAJrR2Lu1F4AaABAg,His  hairstyle  is  so  awesome  
8EJ3zbKTWQ8,UgwwaNW-us_uITfq21V4AaABAg,guys  if  he  doesn't      commit  suicide      THEY  WILL  MAKE  HIS  DEATH  SEEM  LIKE  AN  ACCIDENT    THEY  ARE  GONNA  TRY  TO  KILL  HIM  JUST  LIKE  HOW  THEY  KILLED  AVICII  AND  PAUL  WALKER  FOR  EXPOSING  THE  TRUTH  AND  TRYING  TO  SAVE  CHILDREN    
8EJ3zbKTWQ8,UgzuaVA-8WiP4ZSpLSl4AaABAg,Love  from  Miami
8EJ3zbKTWQ8,UgzIWSZtp2oXoDxQ0il4AaABAg,The  lyrics  tell  a  story    your  incriminating    no  disguise    never  run  low  on  supplies  
8EJ3zbKTWQ8,Ugw-HkvT3ww7ha-fKPx4AaABAg,Yummy  
8EJ3zbKTWQ8,Ugzd_LO9JRkh1UY8wIR4AaABAg,ilove  it  when  i  was  young  i  listen  your  all  song
8EJ3zbKTWQ8,Ugwm7ehc-IXWULZ31_x4AaABAg,I  love  your  song  
8EJ3zbKTWQ8,UgxDHjXLRt3ZAUittT94AaABAg,Im  practicing  to  sing  ur  song    I  like  ur  pink  hair    D
8EJ3zbKTWQ8,Ugz7CrOhZuXDm7hy1-d4AaABAg,Wow    super  voice
8EJ3zbKTWQ8,UgzEkw09fj0oEnZIF8h4AaABAg,I  saw  this  already  but  I  came  back  because  Jungkook  said  so    enjoylife  
8EJ3zbKTWQ8,UgzhpYi07y1it8-0z054AaABAg,I'm  going  to  sing  this  when  red  lobster  has  endless  shrimp  again  
8EJ3zbKTWQ8,UgxpEIX3Y-e-kuRV2Xt4AaABAg,Charity  helps  people  in  need  more  and  more    Live  by  the  law    Be  filial  to  your  parents    grandparents  and  ancestors    No  alcohol    no  stimulants  because  it  affects  health    No  abortion    no  gambling      Do  not  kill  animals    launch  animals    study  hard  and  work  hard    work  hard  to  stay  healthy  with  exercise  and  sports  Live  in  harmony    Live  save  money    save  natural  resources    Plant  many  trees    plant  forests    plant  many  food  crops    plant  many  crops    Help  poorer  countries  a  lot  
8EJ3zbKTWQ8,UgwCsxetQt0encQxkK14AaABAg,2010  baby  baby    baby  2015  sorry  sorry  sorry  2020  yummy    yummy    yummy  2020  stuck  with  you  stuck  with  you
8EJ3zbKTWQ8,UgwG2dOUBXZ4GuBqg9x4AaABAg,there  is  two  meanings  of  this  song      
8EJ3zbKTWQ8,UgxKHqJRdIqh7uXdYul4AaABAg,I  really  like  this  video  it  reminds  me  of  90  s  movies  for  some  reason
8EJ3zbKTWQ8,UgwF3rCr_3An95KAvMZ4AaABAg,This  makes  me  feel  happy
8EJ3zbKTWQ8,UgyYbXeP-W2VGhgfExp4AaABAg,Guy  with  the  glasses  looks  like  Woody  Allen  who  is  married  to  his  ex  wife's  adopted  daughter  whom  he  helped  raise    Hes  also  the  father  of  Ronan  Farrow  who  accuses  him  of  sexually  abusing  his  sister  when  she  was  a  minor    Ronan  went  on  to  be  the  journalist  to  expose  Harvey  Weinstein      See  also    Ricky  Gervais  at  the  Golden  Globes  2020
8EJ3zbKTWQ8,UgwjSWqh3JqcWWcJvU94AaABAg,I  love  the  part  where  he  says  you  got  that  yummy  yum
8EJ3zbKTWQ8,UgxrWIPNDAGMhER1jcN4AaABAg,omg  I  swear  it's  really  hard  hahaha  wow  really  cool  song  really  good  Bassrrrr  wow
8EJ3zbKTWQ8,UgyeK9bTaL4hC4gZHcF4AaABAg,Jesus        I  love  this  song
8EJ3zbKTWQ8,UgwSBk-3hOpCnMqOGON4AaABAg,The  Wiggles      Fruit  Salad    Justin      Yummy  Yummy  
8EJ3zbKTWQ8,UgxZ1xws94m7WsyIVJR4AaABAg,We  all  have  to  keep  in  mind  how  justin  put  himself  in  danger  making  this  production    Justin  might  have  some  mental  health  problems    but  he  is  not  suicidal          He  better  stay  alive      
8EJ3zbKTWQ8,UgyoWMeqrleswQzIZ3l4AaABAg,If  something  happens  to  Justin    the  only  culprit  will  be  the  dark  elite
8EJ3zbKTWQ8,UgybfmAeY2mYZSxH3dR4AaABAg,Before  marriage    Songs  about  girls  After  marriage    Songs  about  foodie
8EJ3zbKTWQ8,UgyTFLw-2_8bIaM1Bhp4AaABAg,I  can  t  believe  we  trashed  this  song  for  so  many  months    That  s  why  he  was  so  extra  in  getting  people  to  stream  and  listen  to  the  song    He  was  legit  trying  to  warn  us  
8EJ3zbKTWQ8,Ugz2L41qonAcxrh9xFd4AaABAg,Waiter      how  was  your  food          Justin      yummy  yum  
8EJ3zbKTWQ8,UgzzAW-4AUz3a9ksUC94AaABAg,2010    Baby  2015    Sorry  2020    Yummy  2025    Curry
8EJ3zbKTWQ8,Ugw868hw_XzAnWzoFz14AaABAg,I  knew  the  meaning  behind  the  song  when  He  told  Ellen
8EJ3zbKTWQ8,Ugy9AGieUAygg-USOEJ4AaABAg,Perfect
8EJ3zbKTWQ8,UgwnUSHx71IvrCEXgW14AaABAg,I  love  it      D        
8EJ3zbKTWQ8,Ugzwuei9pymeTc2OuTV4AaABAg,The  lyrics  is  harder  than  a  math  exam
8EJ3zbKTWQ8,UgwTi3Y_TQUYIgG5CrJ4AaABAg,      THIS  SONG  SOUNDS  LIKE  TWO  SONGS  IN  ONE    
8EJ3zbKTWQ8,Ugy3TMut5tgsTU6COmV4AaABAg,Lots  of  love  from  india  
8EJ3zbKTWQ8,UgzFWGfwGS0XtPUkFSN4AaABAg,I  am  leaving  my  comment  here  so  that  when  someone  like  it  I  get  reminder  of  this  amazing  song      even  after  a  day  or    months  or  years              Love  you  Justin
8EJ3zbKTWQ8,UgyDJ8WhBP34ZmAmKFV4AaABAg,Hi  Justin  I  love  your  music  so  much  your  my  favorite  artisit
8EJ3zbKTWQ8,Ugy_dU8JWEF2pw6Yf594AaABAg,Iam  addicted  this  song
8EJ3zbKTWQ8,UgzPO0kQ4bFTECfPpaR4AaABAg,I  love  jutins  songs  i  love  it  i  always  watch  it  his  soo  famous  i  wish  a  was  famous  too
8EJ3zbKTWQ8,UgyJI8I-0rR6m2lsfdV4AaABAg,Why  people  hate  this  song  I  don't  know    But  I  love  this  song  very  much    Belieber  forever
8EJ3zbKTWQ8,UgzDxPL3ChaL2yxG5AF4AaABAg,Me  singing  to  my  pizza  rolls  heating  up  in  the  microwave  
8EJ3zbKTWQ8,UgyPI1pVa6G0NfqWN_94AaABAg,I  like  how  there  is  so  much  fake  food
8EJ3zbKTWQ8,UgzRUe7mou8_iMJIKgt4AaABAg,I      Like  this    Song
8EJ3zbKTWQ8,UgyG-X9joN3dg5LVjV14AaABAg,When  justin  trying  to  reveal  that  he  wanted  to  do  a  mukbang  show
8EJ3zbKTWQ8,UgzNSkSBpy9G7rtJVbl4AaABAg,It's  amazing
8EJ3zbKTWQ8,Ugz6ecp6qjXVJN3eG8N4AaABAg,how  do  people  still  unironically  like  him  i  
8EJ3zbKTWQ8,Ugx_WWAaqzlpz_aRgJF4AaABAg,I  thought  his  next  single  was  gonna  be  named    Sorry  for  losing  me  to  love  you    or  something      
8EJ3zbKTWQ8,UgyYLKAH0bHTncEJ7oB4AaABAg,I  looked  up  the  silent  children  documentary  and  this  popped  up        trying  to  tell  me  something  about  the  kids  being  kidnapped
8EJ3zbKTWQ8,UgxE0OYj-PPRYnVQ2_R4AaABAg,the  only  lyrics  i  can  understand  are    yummy  yum  
8EJ3zbKTWQ8,UgwLR45kmy-inLP30Bp4AaABAg,This  song  my  fav
8EJ3zbKTWQ8,UgxKA1FqrB_oEiKUZAl4AaABAg,Thank  god  Justin  remember  his  account  password  
8EJ3zbKTWQ8,UgxD9iIHE_k9nvBSCWx4AaABAg,Justin's  jaw  stretches  at  2  21        Could  there  be  an  error  
8EJ3zbKTWQ8,UgzMJzYMpO4Fe6rzHMR4AaABAg,This  is  the  best  music
8EJ3zbKTWQ8,UgzB-Lemln6NxRHe02Z4AaABAg,Very  odd  video    I'm  not  really  a  fan  of  Justin's  othen  than  maybe  2  other  songs    but  I  hope  he's  ok      protected    I  got  chills  watching  this  after  hearing  about  pizzagate  
8EJ3zbKTWQ8,UgzpB8TvhDsNRQem40B4AaABAg,Full  of  love  from  newyork
8EJ3zbKTWQ8,Ugyg8TQQOTjW09TQ91Z4AaABAg,Wow  l  love  this  song    I  like  it
8EJ3zbKTWQ8,Ugzc4B-a2WLgt1O06h94AaABAg,I  feel  like  those  eyebrows  are  staring  into  my  soul  
8EJ3zbKTWQ8,Ugy9t-Z8hhLYqY5KxwN4AaABAg,they  re  deleting  the  comments  about  pizzagate  EVERYONE  RESEARCH  ABOUT  PIZZAGATE
8EJ3zbKTWQ8,Ugw5-CtCpveIC3Zb0Nd4AaABAg,  Harry  styles      Watermelon  sugar  High      Selena  Gomez    Icecream      Troye  Sivan      Strawberries  and  cigarettes      BTS      Butter      Justin      Yummy  
8EJ3zbKTWQ8,Ugx1r7blqZGU-ZKYe1h4AaABAg,Ur  the  good  singer  bro  I  am  new  here  in  ur  channel    from  india
8EJ3zbKTWQ8,UgwOXPJwi_feXyt5-Gh4AaABAg,Pizzagate  isn  t  a    debunked  conspiracy  theory    like  how  google  will  tell  you    It  s  real    Read  the  Clinton  emails    it  s  disgusting  
8EJ3zbKTWQ8,Ugwn6SY8rU-itqkvXPx4AaABAg,They  won  t  kill  him  now  that  we  know    they  may  kill  him  in  a  month  6  months  or  a  year  but  everyone  remember    he  is  better  is  is  happier  and  is  not  suicidal      
8EJ3zbKTWQ8,UgzO9j__nUK5slyid7p4AaABAg,It  s  chilling  how  the  elites  are  giving  him  more  and  more  food  and  the  camera  starts  spinning  uncontrollably  around  him  at  tilted  angles      and  they  start  all  eating  the  food  and  the  food  is  revealed  to  be  Justin  
8EJ3zbKTWQ8,UgxkK2wKx9bMFjRmsPx4AaABAg,if  he  dies  or  has  an    accident    we  know  what  happened
8EJ3zbKTWQ8,UgxsPFKpXXiFgkrTh9l4AaABAg,I  hope  Justin  is  really  happy  to  see  everyone  opening  their  eyes  and  listening  to  him    I  know  you  can  t  talk  about  it  directly  but  thank  you  for  opening  up  peoples  eyes
8EJ3zbKTWQ8,UgwHkpVXJYd48cV2-cF4AaABAg,I  just  remembered  when  Justin  went  on  Ellen  she  asked  him  what    yummy    was  supposed  to  mean  and  it  got  awkward  af  for  a  minute  and  I  ve  heard  a  lot  about  Ellen  being  involved  in  pizzagate  as  well
8EJ3zbKTWQ8,UgwLVy-5a3RuhCIu0y94AaABAg,This  is  actually  terrifying    No  wonder  why  he  wanted  everyone  to  stream  it  so  bad    He  wanted  everyone  to  know  the  truth  
8EJ3zbKTWQ8,UgzP4Rx61Ig53f-LMr14AaABAg,  Lost  control  of  myself    no  compromise    You  re  incriminating    no  disguise    and  you  ain  t  ever  running  low  on  supplies      he  literally  could  ve  just  made  the  song  that  and  it  would  still  tell  you  everything  you  need  to  know  
8EJ3zbKTWQ8,UgxR1MSHFgrJYLykFdZ4AaABAg,Esto  ya  me  est      dando  miedoo  sale  JHON  PODESTA  Y  EL  EX  MANAGER  DE  Justin  creo  que  fueron  ellos  que  abusaron  de  el      Quedaron  solos    al  final    y  en  el  postre  sale  Justin  cuando  era  chico    Y  para  acabar  en  el  minuto  1  47  Justin  dice      PERD    EL  CONTROL  DE  MI  MISMO  ESTOY  EN  PELIGRO    ESTAS  INCRIMINADO    y  en  algunas    partes  de  la  canci  n  en  reversa  dice      Cuando  les  dejo  salir    quieren  que  tenga  miedo  de    ellos    y  eso  me  deja  en  la  derrota    si  ya  no  quieres  estar  en  un  cuarto  con  un  monstruo    y  aquellos  que  me  quieren    que  tiene  dinero    Y  Justin  varias  veces  se  ala  a  su  ex  manager  y  a  JHON  PODESTA      Y  en  el  instagram  de  JUSTIN    l    subi    varias  fotos  de  beb  s  y  con  el  hashtag    YUMMY    Y  la  portada  de    YUMMY    esta  en  forma  como  si  fueran  pizzas    Aqui  hay  un  Link  donde  dicen  todo        https      youtu  be  3efaeMv4a  8    Todo  tiene  sentido    Lo  hab  a  subido  ya      Pero  creo  youtube  me  lo  borro        This  is  already  giving  me  scary  comes  out  JHON  PODESTA  AND  THE  EX  MANAGER  OF  Justin  I  think  it  was  they  who  abused  him        They  were  alone  at  the  end    and  in  the  dessert  Justin  comes  out  when  he  was  a  boy    And  to  finish  in  the  minute  1  47  Justin  says      I  LOST  CONTROL  OF  MYSELF  I  AM  IN  DANGER    YOU  ARE  INCRIMINATED    and  in  some  parts  of  the  song  in  reverse  it  says      When  I  let  them  out    they  want  me  to  be  afraid  of    them    and  that  leaves  me  in  defeat    if  you  no  longer  want  to  be  in  a  room  with  a  monster  and  those  who  love  me    what  have  money    And  Justin  repeatedly  points  to  his  former  manager  and  JHON  PODESTA        And  on  JUSTIN's  instagram  he  uploaded  several  photos  of  babies  and  with  the  hashtag    YUMMY    And  the  cover  of    YUMMY    is  shaped  like  pizza    Here  is  a  link  is  all    https      youtu  be  3efaeMv4a  8    Everything  makes  sense    I  had  already  uploaded  it        But  I  think  YouTube  I  delete  it        Lo  Subire  cada  vez  que  me  eliminen  el  comentario    Porque  me  estoy  dando  de  cuenta  que  los  borran        I  will  upload  it  every  time  the  comment  is  removed    Because  I  am  realizing  that  they  are  erased        
8EJ3zbKTWQ8,Ugxl4sEU1bwDlfrn6i14AaABAg,I  m  so  disgusted  we  should  ve  known  better    If  anything  happens  to  Justin  we  know  what  s  up  guys  let  that  sink  in  
8EJ3zbKTWQ8,Ugz6siPHkLxbAVuWrbt4AaABAg,This  must  be  why  he  was  promoting  the  song  so  much  from  the  beginning
8EJ3zbKTWQ8,UgwUS5NhUhCb7tsH1C94AaABAg,Hailey    write  me  a  song  babe  Justin    YUMMY  YUMMY  YUMMY
8EJ3zbKTWQ8,UgxH836Ldw3gRmvjSnN4AaABAg,This  sounds  like  a  hungry  kid  wrote  this  in  music  class
8EJ3zbKTWQ8,UgwngoXRboF_uAfThD54AaABAg,So  now  what  s  in  the  news  is  him  being  accused  of  assaulting  women  rather  than  the  message  he  was  trying  to  explain  here        nice  
8EJ3zbKTWQ8,UgxvRdMM14dvcaVcaTt4AaABAg,Mans  just  really  liked  his  cake  and  wanted  to  write  about  it
8EJ3zbKTWQ8,UgzDcyuxJIO8m3KpZP54AaABAg,all  the  symbolism  CANNOT  be  a  coincidence
8EJ3zbKTWQ8,UgzbFIHI6PLkYULFAh54AaABAg,When  you're  married  and  not  allowed  to  sing  about  girls  anymore    
8EJ3zbKTWQ8,Ugyq6HTkKH0JLPKdqX14AaABAg,He  had  multiple  panic  attacks  while  filming  this    he  must  ve  gone  through  much    No  one  was  ever  there  for  him  
8EJ3zbKTWQ8,UgwMhqgTrRfQiGi33G94AaABAg,Seeing  his  picture  as  a  child  made  me  cry      Who  knows  if  they  did  this  to  him    
8EJ3zbKTWQ8,UgyOFSJuh24v0h8m1Sh4AaABAg,That's  why  he  promoted  this  song  so  hard    he  wanted  more  people  to  understand  the  real  message  of  this  song      Pizzagate
8EJ3zbKTWQ8,UgzUHD0wa8N5zieWTEh4AaABAg,    The  mansion    The  use  of  old  people      The  fact  that  the  entertainment  is  produced  by  Kids      The  ending    at  3  44  when  the  cake  disappears  there  is  a  picture  of  him      when  he  was  a  kid    Theses  might  be  part  of  the  hidden  message
8EJ3zbKTWQ8,UgzMj_ANfqGKxGtvlsl4AaABAg,Funny  how  OPRAH  has  an  article  on  this  perticular  song  saying    the  song  was  made  for  his  wife    don't  be  fooled  people    Justin  didn't  rape  those  women  either    R    Kelly  tried  to  warn  us  when  he  repeatedly  stated    Its  bigger  than  me    wake  up  
8EJ3zbKTWQ8,UgyOYJdUUne0DbkbFFV4AaABAg,I  feel  terrible  for  judging  on  this  song  when  it  came  out  just  to  know  the  hidden  meanings  behind  it  rn            PS    thank  u  for  488  likes  I  really  hope  people  wake  up  and  know  what  the  media  is  hiding  from  us  and  expose  the  real  truth  of  these  people    
8EJ3zbKTWQ8,UgydqJC8o6KGsvkc4XV4AaABAg,Four  years  ago      I  m  going  to  take  a  small  break  to  figure  out  what  I  want  my  music  to  say  about  myself      Four  years  later  
8EJ3zbKTWQ8,Ugy1dugOltcNTKLyqEd4AaABAg,The  cake  represented  him    The  other  plates  of  food  represent  other  children    I  want  to  cry  
8EJ3zbKTWQ8,UgycsgLowWdwJcni45Z4AaABAg,When  Danny  actually  wrote  this  and  he  is  the  ghost    ghost    producer    His  secret  career      Shhhh
8EJ3zbKTWQ8,UgxzOpg7-sdl9JhSGqZ4AaABAg,Single  life  Yummy    hot  half  naked  girls  dancing  on  you  Married  life  Yummy    old  ladies  and  Jello
8EJ3zbKTWQ8,UgwzHrF-geHut94fOLR4AaABAg,The  kids  playing  the  instruments    basically  symbolizes  the  kids  are  the  entertainment  
8EJ3zbKTWQ8,UgzHdhuJoEVGSL3Ygjh4AaABAg,If  u  see  his  seasons  documentary      it  has  a  scene  that  shows  how  he  was  crying    extremely  anxious  and  feeling  low  while  filming  this  music  video    So  heartbreaking  to  watch    Maybe  it  was  triggering  for  him  being  the  victim  of  pizzagate  
